review_id,review_date,username,course_id,title,description,load_rating,difficulty_rating
1,2022-01-01,Amir,8,"ביקרות על קןרס","קורס מאתגר ומעניין עם מרצה מעולה",4,3
2,2022-01-02,Shira,8,"קורס מרתק","קורס פשוט מאוד עם מרצה מאתגר",2,4
3,2022-01-03,Itai,6,"הכי רלוונטי","קורס מעניין ומאתגר עם מרצה מעולה",1,4
4,2022-01-04,Noa,6,"הכי מועיל","קורס מאוד מעניין עם מרצה מצויין",4,3
5,2022-01-05,Uri,1,"חשוב להמשך","קורס מאתגר ומעניין עם מרצה מצויין",2,5
6,2022-01-06,Michal,1,"ביקרות על קןרס","קורס מאתגר ומעניין עם מרצה מצויין",4,4
